{
  "$schema": "https://json-schema.org/draft/2020-12/schema",
  "type": "object",
  "properties": {
    "delta": { "type": "integer" },
    "delta_max": { "type": "integer" },
    "witness_token": { "type": "string", "minLength": 1 },
    "revocation_list_valid": { "type": "boolean" },
    "semantic_category": { "type": "string" },
    "expect_pass": { "type": "boolean" }
  },
  "required": ["delta", "delta_max", "witness_token", "revocation_list_valid", "semantic_category"]
}
